,original,variant_1,variant_2,variant_3,variant_4,variant_5,variant_6,variant_7,variant_8,variant_9,variant_10
0,Quais sao os ingredientes do Condotril,Quais sao as componentes fundamentais do Condotril,O que compoe o Condotril,Qual e a composicao do Condotril,Em que se baseia a formula do Condotril,Quais sao os principais ingredientes utilizados no fabrico do Condotril,,,,,
1,Quais sao os ingredientes do Duobiotic,Qual e a composicao quimica do Duobiotic,O que contem o Duobiotic como ingrediente ativo,Sao quais os componentes do Duobiotic,Quais sao as substancias presentes no Duobiotic,Qual e a formula do Duobiotic,,,,,
2,Quais sao os ingredientes do Neurofil,Qual e a composicao do Neurofil,Quais sao as substancias que compoem o Neurofil,O que esta presente no composto conhecido como Neurofil,Que ingredientes ou componentes fazem parte da estrutura do Neurofil,Quais os constituintes quimicos do Neurofil,,,,,
3,Quais sao os efeitos do Condotril,O que acontece com as pessoas que utilizam o Condotril,Quais sao as consequencias de usar o Condotril,Como afeta o corpo humano o uso do Condotril,Quais sao os danos causados pelo Condotril,O que acontece com a saude quando se utiliza o Condotril,,,,,
4,Quais sao os efeitos do Duobiotic,Qual e o resultado de usar o Duobiotic,O que acontece quando se toma o Duobiotic,Quais sao as consequencias de consumir o Duobiotic,Como afeta o organismo o uso do Duobiotic,Quais sao os efeitos colaterais ou secundarios do Duobiotic,Qual e a resposta do corpo ao Duobiotic,,,,
5,Quais sao os efeitos do Neurofil,1 Qual e o impacto do Neurofil no organismo,2 Como afeta o corpo humano o consumo de Neurofil,3 Quais sao as consequencias da ingestao de Neurofil,4 O que acontece com o corpo quando se toma um produto contendo Neurofil,5 Quais sao os efeitos secundarios do uso de produtos que contem Neurofil,,,,,
6,Qual e o processo de toma do Condotril,Como se desenvolveu o processo de construcao do Conquistador,Quais foram as etapas que levaram a criacao do Condotril,O que aconteceu para que o Condotril fosse construido,Descreva como foi feito o processo de elaboracao do Condotril,Quais sao os principais passos que compuseram a construcao do Condotril,Como foi organizado e executado o projeto do Condotril,Qual foi o fluxo de trabalho usado para criar o Condotril,,,
7,Qual e o processo de toma do Duobiotic,Como funciona a tomada do Duobiotic,O que e necessario para tomar Duobiotic,Quais sao os passos para administrar Duobiotic,Qual e o procedimento para ingestao de Duobiotic,Como se toma corretamente o Duobiotic,,,,,
8,Qual e o processo de toma do Neurofil,Como se adquire o Neurofil,O que e necessario para obter o Neurofil,Quais sao os passos para adquirir o Neurofil,Qual e a forma correta de obter o Neurofil,Quem pode tomar ou comprar um Neurofil,,,,,
9,Quais sao as condicoes de armazenamento do Condotril,1 Como devem ser armazenadas as pecas da Condotril,2 Quais sao os requisitos para o armazenamento do Condotril,3 O que e necessario saber sobre a conservacao do Condotril,4 Em que condicoes deve ser guardado o Condotril,5 Qual e a recomendacao para o armazenamento de partes da Condotril,6 Quais sao as normas para o armazenamento do Condotril,7 Como devemos proceder para armazenar o Condotril de forma adequada,8 Quais sao os criterios para o armazenamento e conservacao do Condotril,Essas perguntas mantem a mesma essencia da original,apenas com diferentes frases e estruturas
10,Quais sao as condicoes de armazenamento do Duobiotic,Em que condicoes o Duobiotic deve ser armazenado,Quais sao as recomendacoes de armazenamento para o Duobiotic,Como devem ser armazenadas as amostras do Duobiotic,Qual e a temperatura ideal para armazenar o Duobiotic,Onde e como devem ser armazenados os produtos contendo Duobiotic,Quais sao as condicoes especificas de armazenamento necessarias para o Duobiotic,,,,
11,Quais sao as condicoes de armazenamento do Neurofil,Em que condicoes deve ser armazenado o Neurofil,Qual e as especificacoes de armazenamento para o Neurofil,Quais sao os requisitos para armazenar o Neurofil corretamente,Como devem ser armazenados os Neurofils,O que e necessario para armazenar o Neurofil de forma segura,,,,,
12,Em que casos nao se pode tomar Condotril,Em quais situacoes nao e recomendado o uso de Condotril,Quais sao os casos em que o Condotril nao deve ser tomado,Em que condicoes medicas ou cirurgicas o Condotril nao pode ser administrado,Quem nao pode tomar Condotril e por que,Qual e a lista de contraindicacoes para o uso do Condotril,,,,,
13,Em que casos nao se pode tomar Duobiotic,Em que situacoes nao e recomendado tomar Duobiotic,Quais sao os casos em que o Duobiotic nao deve ser consumido,Em que condicoes medicas nao se pode usar Duobiotic,Em que momento ou circunstancia nao se recomenda a administracao de Duobiotic,Quais sao as contraindicacoes para o uso de Duobiotic,,,,,
14,Em que casos nao se pode tomar Neurofil,Em quais situacoes o Neuroflam nao e recomendado,Em que condicoes medicas nao se deve usar Neuroflam,Quem nao pode tomar Neuroflam,Em que casos ha contraindicacao para o uso de Neuroflam,Qual e a lista de exclusao para o medicamento Neuroflam,Quais sao os cenarios em que o Neuroflam nao e apropriado,,,,
15,Quantas doses tem a embalagem do Condotril,Qual e o conteudo em doses da embalagem de Condotril,Em quantas doses esta contido o medicamento Condotril na sua embalagem,Quantas unidades de Condotril tem na embalagem padrao,Como estao organizadas as doses do Condotril na embalagem,Quais sao as doses individuais que compoem a embalagem de Condotril,,,,,
16,Quantas doses tem a embalagem do Duobiotic,Em que quantidade de doses esta disponivel o medicamento Duobiotic,Quais sao as opcoes de doses para uma embalagem do Duobiotic,Quantas unidades ou pastilhas,etc tem a embalagem padrao do Duobiotic,Qual e o conteudo em doses da embalagem do medicamento Duobiotic,,,,,
17,Quantas doses tem a embalagem do Neurofil,Quao muitas doses de Neurofil estao na embalagem,A embalagem do Neurofil contem quantas dosagens,Em que quantidade a embalagem do Neurofil esta distribuida,Quantos recipientes de dose tem a embalagem do Neurofil,De quantas vezes faz a embalagem do Neurofil,,,,,
